{
  "base_sha": "7b87c9be507507dc2c72ab3a4b534947cf875916",
  "finalized_at": "2026-08-10T07:43:53Z",
  "issue_number": 28,
  "kind": "batch",
  "proposal_commit_sha": "9489112b87d9903e5bb562234393a79e30e21720",
  "pull_number": 29,
  "pull_url": "https://github.com/JunieXD/AutoEmailSender-MentorData/pull/29",
  "schema_version": 1
}
