{
  "base_sha": "e274cc2099fa8829c04edccea15d9b9082a705b2",
  "finalized_at": "2026-08-22T09:17:18Z",
  "issue_number": 158,
  "kind": "batch",
  "proposal_commit_sha": "945ac69bfdaafefbe37a45e196122147abba038e",
  "pull_number": 167,
  "pull_url": "https://github.com/JunieXD/AutoEmailSender-MentorData/pull/167",
  "schema_version": 1
}
